-1.72661334626707	helen graf and heather xi solyariya in five years the outstanding defeats .	海伦·格拉芙和希瑟·斯坦宁在五年中未尝败绩。
-1.63781318601382	and chen yibing , who led china to the 2012 olympic group champion , was also the king .	而陈一冰则在率领中国拿到2012年奥运团体冠军的同时，也成为了吊环王。
-1.60192713963974	through the successful occupation of the president at new york , 3,000	戴图理凭借 Predilection 在纽马基特的成功取得职业3,000胜
-1.4829333207708701	as the of jin man , , the olympic games to the olympics , injury to him , the three - line attack , a great deal .	作为金满贯得主的纳达尔，对奥运会情有独钟，伤未痊愈的他，此次三线出击，斩获颇丰。
-1.4554492936678298	and we face women .	而我们则面向女性。
-1.45243953271063	after all the athletes stepping into a new field , whether it is ability or contacts , are a blank state .	毕竟运动员踏入一个新的领域，无论是能力还是人脉，均是一个空白状态。
-1.36973996646155	&quot; other internet users believe that the other internet users are actually identical , &quot; he said online .	一位推特用户最近开心地在网上宣称“其他网民也认为霍普·索罗和珍妮弗·卡彭特实际上长得一模一样。”
-1.3480292305576298	liu kuyu &apos;s forbidden area in front of the ferocious shovel to violate kermez , he and his emotional agitation wang the succession to the yellow card .	刘宇禁区前凶狠铲抢侵犯克里梅茨，他与情绪激动的王栋相继领到黄牌。
-1.33455075740676	kuwait gentleman has played the role of a moue .	科先生扮了个怪相。
-1.30757052229347	in the 37th minute , mr ann undertook a change of change , zhang xiaobin , zhang ming in the old lord .	国安在第37分钟就进行换人调整，张晓彬下场，张池明登场反戈旧主。
-1.3019529119576698	the 63 homeless , a 63 homeless , had a knife with another tramp , and he was killed by a knife .	现年63岁的流浪者韩某与另一流浪汉肖某酒后发生争执，遂持刀将其扎死。
-1.29513179836859	&quot; it makes me flattered , &quot; said glasgow bike hand skinner , aged $ number . &quot;	23岁的格拉斯哥自行车手斯金纳表示：“这让我受宠若惊。”
-1.25343673590203	before long , also launched a series of &apos; s works .	前不久，努比亚也推出了其Z11系列的首款作品：nubiaZ11mini。
-1.25035451033567	the parents &apos; actions will affect the growth of the child , and they will imitate their parents , which is often said to be the dragon , the phoenix , the mouse , the child will make a hole , the parents what kind of child .	父母的一言一行都会影响到孩子的成长，他们会模仿自己的父母，也就是人们常说的龙生龙，凤生凤，老鼠的儿子会打洞，父母什么样孩子就什么样。
-1.24503937515493	朗兹曼 wrote .	朗兹曼写道。
-1.22901166722857	&quot; i thought that in addition to the cheek hu , it is not very long , &quot; brady told the huffington post .	“我自认为除了络腮胡以外，并不是长得很像，”布莱迪对《赫芬顿邮报》(Huffington Post) 说。
-1.2137111010866102	liu xuan beautiful appearance so that she was quickly remembered , but also laid her future into the entertainment circle basis .	刘璇靓丽的外表让她迅速被人们记住，也奠定了她今后进军娱乐圈的基础。
-1.18685198644682	kepler surveys to raise su cluster star the auto-rotation rate	开普勒测量昂宿星团恒星的自转速度
-1.1443216124268	he and his daughter took part in a variety show such as &quot; where &apos;s daddy go , &quot; which made him pay attention .	而他和女儿参加“爸爸去哪”等综艺节目，更是让他赚足了眼球。
-1.14256733968366	it is particularly interesting to note the government &apos;s response to the hungry people , such as the president &apos;s people herbert buddha &quot; other people &apos;s things i can not control &quot; attitude .	尤其值得玩味的是政府对于饥饿民众们的回应，比如总统市民赫伯特·胡佛“别人的事我可管不了”的态度。
-1.1421228030850301	in fact , the 50-meter freestyle is not the main item in ningzhi , his performance and best achievement on the kangshan world championship , also determined that he is unlikely to make a breakthrough in this project .	其实50米自由泳并非宁泽涛主项，他在喀山世锦赛上的表现和最好成绩，也决定了他在这个项目取得突破的可能性不大。
-1.1140276620743301	ten thousand steps to say that it &apos;s handsome , completely relying on the value of the support of the brain powder .	退一万步说，宁泽涛长得帅，完全可以依靠颜值获得万千脑残粉的支持。
-1.11265606369633	as far as this remarkable project is concerned , the dragon shows the backbone of civil engineering .	就该了不起的项目而言，此次合龙展现出前沿的土木工程技术。
-1.08057901170094	the opening ceremony of the opening ceremony of the first olympic games of yunnan province on the opening ceremony of yunnan province	云南省首届青运会13日开赛开幕式打民族牌展示青春活力
-1.06951942597958	balls was 19 years old. from earlier this week , the news has spread like a virus on twitter , and was a .	拜尔斯才19岁。从本周早些时候起，其消息就在推特上病毒般传播开来。就拜尔斯而言，其人生已被赋予了全新意义。
-1.06731157885283	it is understood that law enforcement departments have had to travel in urumqi in west park , red tourism , such as retail districts were checked .	据了解，此前乌鲁木齐市旅游执法部门已对西公园、红山等旅游散客集中的地方进行了检查。
-1.0593871132586998	unlike many internet healthcare companies , i was initially focused on the vertical field of the internet obstetrics , with deep tillage and doctors on both sides .	与很多互联网医疗公司贪大求全不同，iBaby从最初就专注于互联网产科垂直领域，深耕孕妈和医生两端。
-1.0547854299959398	studying urban planning expert juan yilin sichuan there to visit to learn about local architectural design , and a man who has to travel .	就读城乡规划专业的黄伊琳想去四川阆中参观学习当地的建筑设计，于是一家人便前往旅游。
-1.04598531163416	a family in a house in cornwall there were floods destroyed former projects outside of tash , saul .	一户流氓家庭在遭驱逐前毁坏位于康沃尔郡索尔塔什的廉租房
-1.0190016964198	calderon grams out of the terminal point shot low to the left of the penalty area , fernando , the ball deflecting off thujas calderon grams .	卡尔德克禁区前摆脱分球，费尔南多禁区左侧低平球传中，卡尔德克顺势推射破门。
-1.01213124021282	diagram made a career 3 , 000 win in newcastle on the success of the prefect .	戴图理凭借 Predilection 在纽马基特的成功取得职业3,000胜
-0.998587179494897	ms. , who lived in the apartment for $ number years , said : &quot; it &apos; s like a bomb has fallen off . &quot;	据悉，在这栋公寓住了30年的杜雷女士(Mariana Turay)表示：“好像有炸弹掉下来。”
-0.975440648476935	mr. khan , who is 63 years old and a homeless drifter shaw , a drunken dispute with a knife , then it would be .	现年63岁的流浪者韩某与另一流浪汉肖某酒后发生争执，遂持刀将其扎死。
-0.967611030018583	&quot; it &apos;s a brilliant performance , music , light , stage performance , i &apos;m impressed ...................................................................................................................	“这是一场精彩绝伦的表演，音乐、灯光、舞台表演都让我印象深刻，……我觉得很有必要让女儿也来了解中国文化和中国京剧艺术。”
-0.9604394711674421	it is a long-term career that is consistent with the socialist value system , said sun jianbo , a member of the communist party committee of the former hill forest .	全国道德模范提名奖、原山林场党委书记孙建博说，雷锋精神传承着时代的真善美，是一项符合社会主义价值体系的长久事业。
-0.9560104888191808	liu yu restricted area before the vicious shovel to grab the violations of the kerry metz , he with the emotion of wang dong in succession received a yellow card .	刘宇禁区前凶狠铲抢侵犯克里梅茨，他与情绪激动的王栋相继领到黄牌。
-0.9366526572046942	in this case , ningbo tao , even if you choose to retire into the entertainment circle at this time , is not only his freedom , but also a plausible path .	在这种情况下，宁泽涛即使选择在此时退役加入娱乐圈，不仅是他的自由，也是一条看似可行的道路。
-0.936214921333008	many of the factors outside the court may have a great impact on his thoughts on the future , and he is now more interested in entering the entertainment circle .	场外的许多因素，可能对他对未来的想法产生了很大影响，他现在对进军娱乐圈可能更感兴趣。
-0.9253250248869209	the opening ceremony of the opening ceremony of the opening ceremony of the first olympic games in yunnan province	云南省首届青运会13日开赛开幕式打民族牌展示青春活力
-0.9212211233507509	in fact , this archery player realized that the hype of public relations media and acknowledged hit some young people to say one likely the small plum .	事实上，这位射箭选手察觉到了社交媒体的炒作并承认打小就有人说自己长得像小李子。
-0.912759516560747	in the first book , mr. krugman &apos;s last book on the united states was a chinese food , and ms. zizman told the life story of the slum-tenants by food in her 97 orchard .	科先生的上一本书《炒杂烩菜》是关于美国的中餐，而齐格曼女士在她的《97果园》一书中通过食物讲述了贫民区租客们的生活故事。
-0.9123177558797769	when zhao xiapping submitted the application form for reservation and trading began a preliminary trial of the application materials for the first trial of the application for the application and the environmental impact report on project editions , qingdao city settlement center environmental impact of the construction project , after which .	赵秀平提交了申请表、建设项目环境影响报告书等材料后,青岛市排污权储备和交易服务中心开始对申请材料进行初审。
-0.906334559617343	an indian uncle week at dubai international airport , where he was hit by a plane crash , and this week won a $ 1 million jackpot at the same airport .	印度一名大叔上周刚在迪拜国际机场经历飞机机腹着陆惊魂，本周就在同一座机场中了100万美元大奖。
-0.9024103246514771	integrated two times to check the situation , urumqi tourism law enforcement detachment vice captains ma qi said : “ the first is safety , the second is the norm , the travel of the vehicle is no small matter , once the problem is the group hurt the group of death . ”	综合两次的检查情况，乌鲁木齐市旅游执法支队副支队长马琪说：“第一是安全，第二是规范，旅游车辆无小事，一旦出问题都是群伤群死。”
-0.880568627161037	in the beijing and london olympics to show its absolute dominance after the british cycling team heading to rio in the process make everyone somewhat disappointed .	在北京和伦敦奥运会上展现其绝对统治地位后，英国自行车队在前往里约的过程中让大家略感失望。
-0.878318422800747	in 2012 , she and her teammates were not trusted .	2012年，她和她的队友都不被看好。
-0.8657412537095369	these lenses have the effect of passivation and bending characteristics and produce more than 30 million passing self .	这些透镜具有钝化、弯曲特征的效果，每天产生3000多万张经过修饰的自拍。
-0.8598393636681808	hebei clearly issues a residence permit within 3 working days from the date of admissibility .	河北明确，对符合申领条件、材料齐全的，居住地公安派出所应自受理之日起3个工作日内发放居住证。
-0.857322200007337	the parents &apos; words and actions will affect the child &apos;s growth , and they will imitate their parents , the dragon born dragon , the phoenix born phoenix , the mouse &apos;s son will make holes , the parents what kind of child .	父母的一言一行都会影响到孩子的成长，他们会模仿自己的父母，也就是人们常说的龙生龙，凤生凤，老鼠的儿子会打洞，父母什么样孩子就什么样。
-0.8563491541181291	the feeder , the old edmond river , the northern skating river , and other feeder channels take the way of purely market operation .	白马河、老万福河、北大溜河等支线航道采取的是纯市场化运作的方式。
-0.849027615352193	how to use marcella to protect himself in a gun attack	如何在持枪攻击中使用马伽术保护自己
-0.840280401848986	15 years ago and had watched the beijing opera performances of marisa jimenez card of joe with his daughter watching the show .	１５年前曾观看过京剧演出的玛丽萨·希门尼斯·卡乔陪着女儿看完演出。
-0.8306002655850809	the first youth games in yunnan province of yunnan province , hosted by sports people i will be hosting the games in 13 days at the opening ceremony .	云南省第一届青少年运动会由云南省体育局主办，芒市人民政府承办，运动会将于13日上午举行开幕式。
-0.8304138790884301	fresh fruit is cheap dried fruit instead .	新鲜的水果被便宜的干果所代替。
-0.8279352924033101	the brown &apos;s grotesque , legs , arms and abdomen were wound , they said , but the child was awake on the way to deliver a medical doctor .	他们说，Brown 的腹股沟、腿、胳膊和腹部等部位有多处枪伤，但是孩子在送医途中是清醒的。
-0.821852420500533	the choice and blair and the cameron two male prime ministers two female prime ministers liked the hot place taking vacation to form the contrast .	两位女首相的选择和布莱尔和卡梅伦两位男首相喜欢到较热的地方度假形成了反差。
-0.8211913852255021	parents say that , whether meeting or calling , shen tan was rarely saying his hard and more is to be happy with parents .	父母说，无论是见面还是打电话，张彬彬很少说自己的辛苦，更多的是跟父母聊些开心的事。
-0.814660003603784	in accordance with the terms of reference set out in the terms of reference and in accordance with the terms of reference , the committee will investigate and impose penalties in accordance with the terms of reference .	林全强调，如果政党、附随组织或受托管理人等违反条例所定禁止处分的规定，委员会将依职权调查并“依法”处分、裁罚。
-0.8042171150399008	jane zigman said : &quot; the people who this is for on food with suffered hardships share joys and sorrows . &quot;	珍·齐格曼表示：“这是为了在食物上与正在受苦的人们同甘共苦。”
-0.8020603807023851	the race after 10 minutes , lifan continuous impact , even won the corner kick opportunities , fernando small-angle volley was the national security line of defense blocking out the bottom line .	比赛进行10分钟后，力帆连续冲击中连获角球机会，费尔南多小角度抽射被国安防线挡出底线。
-0.801924280954058	his mother , queen of dragons told reporters , in their hesitation , zhang binbin to the village with several “ novel guest ” on .	其母张小龙告诉记者，就在他们犹豫时，张彬彬找来了同村的几个“小说客”。
-0.801393753719994	what she knows is the us team has obtained four winning streaks at olympic games , and after will have defeated japan the uk team that with the group on 2 : 0 of thursday has not been defeated competes for the group first .	她所知道的是美国队在奥运会上已取得四连胜并且将与小组中在周四以2比0战胜了日本队后未尝败绩的英国队争夺小组第一。
-0.7954935199523551	the features have become a major problem in the presidential campaign .	联邦税已成为总统竞选中的一大问题。
-0.7876591560808142	reid said it was the republican presidential candidate donald trump , the republican nominee , and the &quot; winner &quot; of the republican presidential nominee .	里德说，阻止加兰德提名的共和党人是共和党总统候选人唐纳德·特朗普 (Donald Trump) 的“宠臣”与“成就者”。
-0.7760676824931351	far more than thousands of thousands , the story of greecia is moved by the famous documentary director paula mareda and the exploration of the producer of news channels .	远在千里之外，巨嘴鸟格雷西亚的故事感动了著名纪录片导演葆拉·埃雷迪亚和探索新闻频道制片人约翰·霍夫曼。
-0.775879813493547	they have maintained the record of a record , with absolute superiority .	她们已保持了39场不败纪录，具有绝对的优势。
-0.7716649855850991	middle and lower reaches the same day competition , zhang binbin once placed , seems very remote from the finals .	在当日的比赛中，张彬彬一度排名中下游，似乎距离决赛十分遥远。
-0.7630348866762571	old rejoice , the river flows through channels , with the shanghai , diaoyudao nanyanghu into the grand canal , the main channel of 32.5 kilometers in length .	老万福河航道流经金乡、鱼台,经南阳湖进入京杭大运河主航道,全长32.5公里。
-0.760150049617118	&quot; but individual owners who bought a cell block were afraid to do so would affect their car rental prices and doubted that other people had private hearts , so it was put on hold , &quot; he said .	“但是购买了小区车位的个别业主，怕这样做会影响自己的车位出租价格，也怀疑其他人存有私心，所以一直背后搞破坏，导致车位改造一事被搁置。”
-0.760146580141145	another post pointed to the hotel &quot; really don &apos;t have a face &quot; and pointed out that the main street in the famous kudam street was near a synagogue .	另一个帖子直指酒店“真不要脸”，并且指出这家位于著名的库达姆大街的大街就在一座犹太教会堂附近。
-0.748297793460918	after only four minutes of the race , jerry scored again on the right wing .	比赛仅仅过了四分钟，杰瑞·图怀又在右翼触地得分。
-0.7410575879013209	with the present implementation opinion spirit , inconsistent policies and measures will carry out a concentrated cleanup , the modified seriously modified , the abolition of the resolutely abolished .	对与本实施意见精神不一致的政策措施将进行一次集中清理，该修改的认真修改，该废止的坚决废止。
-0.7351510439405792	fiji seems to be born with seven people making rugby football , and the british team is still a louddle .	斐济人就好像生来就是打7人制橄榄球的，而英国队仍是初出茅庐。
-0.7256693698189149	the audience followed the story of the famous story , the singing of the actors , and sometimes a smile and a warm applause .	观众们跟着《白蛇传》情节的起承转合、演员的唱念做打，时而会心微笑，时而热烈鼓掌。
-0.7184754911543259	a woman was killed and killed on a swiss highway	一名女性在瑞士高速公路上自杀并被辗身亡
-0.7125341595404651	2015 latest monitoring data show that only in jilin province in the territory of the monitoring to the wild tiger 27 , the northeast leopard 42 only .	2015年最新监测数据显示，仅吉林省境内就监测到野生东北虎27只、东北豹42只。
-0.705276655898498	&quot; there are 288 greenfield investments in brazil , compared with 314 years from 2003 to 2014 . &quot;	“在巴西共有288个‘绿地投资’项目，而2003年至2014年的年平均量为314个”。
-0.7032631744810439	at present , doctors have three plates to continue to educate doctors , doctors and doctors for help .	目前医生端开设三个板块，分别为医生继续教育、医生社交和医生求助。
-0.68595322550555	japan &quot; entered often &quot; road to begin in the early 1990s , but was initiated africa that to develop the conference to begin in 1993 by japan similarly , this was not the coincidence !	日本“入常”之路始于上世纪90年代初，而由日本发起的非洲开发会议同样始于1993年，这不是巧合！
-0.681776082730021	tanabata activities by the scene of the young workers of the wide acclaim , have hoped that the company later organized such activities , and more young people to strengthen communication and exchange .	七夕活动受到了现场青年职工们的广泛好评，纷纷希望该公司以后多举办这样的活动，与更多其他的青年加强沟通与交流。
-0.6658545114922989	zhan qixian believes that so long as today also has the party to produce , nobody the society will donate money to you , if the party produces is confiscated to take away entirely , kuomintang just may request that the community support and support , &quot; today had not had really the opportunity to want &quot; .	詹启贤认为，今天只要还有党产，没有人会给你社会捐款，若党产统统被充公收走，国民党刚好可请求社会支持与赞助，“今天真的没有了才有机会去要”。
-0.6589798773605781	but the 24-year-old olympian wasn &apos;t the only gold medal winner in the summer olympics , at least in social media .	但是这位24岁的奥运选手不是本届夏季奥运会上唯一一位撞脸名人的金牌争夺者，至少社交媒体不这样认为。
-0.6550175177560079	recently , zhejiang tongxiang city zheng fu village the lion bang lotus expo officially for the villagers and visitors to open .	近日，浙江省桐乡市正福村狮子浜的荷博园正式对村民和游客开放。
-0.64868411925453	8 : 00 am , stopped approximately 10 to carry the bus of tourist around the kaibinsiji hotel , these vehicles mostly were on the 1st go to tianchi the individual tourist group of tour .	昨天早上八点，在凯宾斯基酒店周围停了约10辆满载游客的大巴车，这些车辆大多都是前往天池一日游的散客团。
-0.6466507058854221	as part of the &quot; cultural exchange year pulling in &quot; key performance project , on august 9-23 , the china national peking in the mexican city of ciudad juárez , córdoba and five city opera performances seven games .	作为“中拉文化交流年”重点演出项目，８月９日至２３日，中国国家京剧院在墨西哥首都墨西哥城以及科尔多瓦、华雷斯等５座城市演出７场京剧。
-0.642129688572943	after the judgment came into force , wang made an application for compulsory execution after he failed to comply with the obligation to determine the sentence .	判决生效后，因李某没有自动履行判决确定的义务，王某向沭阳法院申请强制执行。
-0.623834608859857	friends also often communicate online , &quot; prior to friends because some misunderstandings have not been contacted for some time , later in a large group of conversation in a few words is hot again . &quot;	爱交友的也常用线上交流，“之前跟朋友因为一些误会有段时间没联络了，后来在一个大群里先对话几句才又热络起来。”
-0.6222669387314721	the court found that the &quot; very ridiculous abuse &quot; of the muslim community &apos; s religious feelings , and to the sword of his racial discrimination and the islamic phobia allegations of the allegation .	该法庭发现，拉赫曼“非常可笑地滥用”穆斯林社区的宗教情感，并对剑指他种族歧视和伊斯兰恐惧症的指控闭口不谈。
-0.616942079506517	in the first half , sarkozy showed his ability to pull space on the pitch , and he could shoot the basket out of a three-point line after his teammate &apos;s blockage was removed .	上半场，萨里奇展现出了他在场上拉开空间的能力，通过与队友的挡拆之后，他在三分线外能命中投篮。
-0.604764374362524	is pregnant mother not only to be able free 24 hours to interrogate with the one-to-one head doctor , but can also the payment direction detection seek the medicine to interrogate .	孕妈不仅可以免费24小时和一对一的主管医生问诊，还可以付费定向寻医问诊。
-0.6037974838192329	it was a year - and - a - half years ago , with a broken beak , a dying mouth , and now a new life .	这只一年半前被人折断上喙、奄奄一息的巨嘴鸟，如今终于重获新生。
-0.602101266850541	devon and angela crow of cornwall police authorities indicated that this pursuit continued to defy the renter rule the lessee who to issue the explicit warning to other .	德文郡与康沃尔郡警局的 Angela Crow 表示，此次驱逐向其他继续违抗租户规则的租客发出了明确警告。
-0.6015232668576961	&quot; online looks up this special holiday , therefore decides to come to see , feels very fresh . &quot;	“在网上查到这个特别的节日，所以决定来看看，感到很新鲜。”
-0.59114734563159	marissa himenez kajo , who had watched the peking opera performance 15 years ago , was watching the show with his daughter .	１５年前曾观看过京剧演出的玛丽萨·希门尼斯·卡乔陪着女儿看完演出。
