0.15164993850412198	his character is good for the british horse , but in addition , he is an incredible jockey .	他性格活泼，这对英国赛马来说是好事，但是除此之外，他还是一位不可思议的骑师。
0.159685592690215	it may not be of interest to the us air force , although a steady stream of free electrons can help people listen to the radio on the edge of a university radio station .	虽然拥有稳定的大量自由电子的电离层可以帮助人们在某个大学广播电台的播送范围边缘收听这个电台，但这或许不是美国空军的兴趣所在。
0.16504641730147399	on thursday , simone helped the u.s. team achieve four titles in the women &apos;s individual all-around project .	周四，西蒙帮助美国队在女子个人全能项目上实现四连冠。
0.17272189728550305	i live in the hospital , although they say that walking a few steps is enough , but i still walk around the ward 20 feet , 30 feet , 50 feet .	我住在医院里，虽然他们说走几步就足够了，但我还是每次绕着病房走上20英尺、30英尺、50英尺。
0.18068241855862302	in addition , female greenland &apos;s greenland shark is allegedly mature when it is about 4 meters long , and the age is the age of at least 156 years old .	此外，雌性的格陵兰鲨据称要到身长约4米时才能性成熟，换算成年龄也就是至少要到156岁才成年。
0.186033182184591	agl said the company had written down the value of the $ 187 million contract in the &quot; termination of activity expectations &quot; .	AGL表示，公司已在“终止活动预期”中减记了1.87亿美元的合同价值。
0.19548362645608802	the games have benefited stratford and the east .	奥运会使斯特拉特福德和东区受益匪浅。
0.196765466186042	according to forecasts by the tower &apos;s department of trade and economic development , the economy in tasmania will grow by 7 per cent in 2016 , and inflation in the country is essentially above that level .	根据塔贸易和经济发展部的预测，2016年塔国的经济增长将达到7%，而国家的通胀也基本是在这一水平之上。
0.20478973044461302	louis galicia said frank lived in the guest house at first , but recently &quot; everything is finally getting better . &quot;	Louis Galicia 称 Frank 起初住在招待所里，但是最近“一切终于好起来了。”
0.205766257348703	last week , clinton held a rally in omaha , nebraska , where mr buffett asked trump to meet and exchange tax returns .	上周，克林顿在伯克希尔·哈撒韦公司所在的内布拉斯加州奥马哈举行了一次集会，巴菲特在会上要求特朗普见面并交换纳税申报单。
0.20661310445165998	queensland community law centre director james farrell said thousands of people were turned away each year , according to the latest national community association law centre investigation report .	昆士兰社区法律中心负责人詹姆斯·法雷尔表示，根据最新的国家社区协会法律中心调查报告，每年有数千人被拒之门外。
0.212198532186675	at this sorrow , we express our deep sympathy and condolences to frank &apos;s family and friends .	在这个悲痛的时刻，我们向 Frank 的家人及朋友表达我们深切的同情与哀悼。
0.213208470237938	the doctor told xue that chronic bronchitis would be less likely to be cured , but the use of drugs could be eased .	医生告诉薛大娘，慢性支气管炎想要根本治愈的可能性不大，平常坚持用药可有所缓解。
0.215448145832023	&quot; so , it can be seen at the time that there were a number of armed men in a state of war , &quot; the philadelphia police chief anthony ginaldi told the television station .	“所以，由此可见当时现场有多名武装人员处于激战状态，”费城警察局长Anthony Ginaldi 对电视台说。
0.22131462937492397	china &apos;s mars exploration launch target is to want to step around , landing , patrol , this task has considerable difficulty .	我国的火星探测发射目标是想一步环绕、着陆、巡视，这个任务具有相当大的难度。
0.221732000896447	according to the chongqing meteorological bureau portal to the district county high temperature weather statistics , in addition to the unitary yang , the rest of our city can receive a different degree of high temperature allowance .	根据重庆市气象局门户网对各区县高温天气的统计，除酉阳外，我市其余各地都能领取到不同程度的高温津贴。
0.22787743081830497	however , official view - once was regarded as the candidate of presidential candidate suddenly chose to wield the environmental policy of russia - has brought in numerous suspicions .	但是，官方说法——一个曾被视为总统候选人的人选突然间选择执掌俄罗斯的环境政策——引来了众多怀疑。
0.22957763943145998	good family education means that parents need to regularly accompany their children , give their children care , patience to take care of , and also need to teach children to develop a civilized demeanor , let the children better learning knowledge , enhance intelligence .	良好的家庭教育意味着父母需要经常的陪伴孩子，给孩子关爱，耐心的照顾，另外还需要教孩子养成文明的言行举止，让孩子更好的学习知识，提升智力。
0.231006938790042	the report emphasizes that abe &apos;s cabinet is trying to make a breakthrough through the above three points , to promote japan &apos;s &quot; normal nationalisation , &quot; the self-defense forces to go out and intervene in international security matters , strengthen the japanese-american alliance , and defend china &apos;s multiple objectives .	报告强调，安倍内阁试图通过以上三点突破，达到推动日本“正常国家化”、自卫队走出去介入国际安全事务、强化日美同盟、防华制华的多重目的。
0.237357432491059	the project , which belonged to mechanical processing enterprises , applied for the initial discharge rate of 0.514 tons of chemical oxygen demand ( cod ) and 0.052 tons of ammonia nitrogen ( nox ) .	该项目属于机械加工企业,申请的初始排污权为化学需氧量(COD)0.514吨/年、氨氮(NOX)0.052吨/年。
0.24221764186883396	clinton &apos;s campaign assistant , jennifer palmeyi , said in a statement that hillary clinton and tim kahn will continue to be a financially transparent pole .	克林顿的竞选助手詹妮弗·帕尔米耶里在一份声明中表示：希拉里·克林顿和蒂姆·凯恩将继续成为财务透明的标杆。”
0.243142008889609	this is not a big club , it &apos;s not the royal ascot race ( royal ascot ) , it is only with an average of 20,000 spectators on friday night .	这不是一场大规模的赛马会，也不是英国皇家爱斯科赛马会 (Royal Ascot)，这只是一个有着20,000名观众的普通的周五晚上。
0.243988029079401	strengthen training to ensure that staff strictly enforce the requirement that &quot; voters go to the voting hall alone . &quot;	加强培训，确保工作人员严格执行“选民单独去投票厅”的规定。
0.24496419646880604	this is only one part of &apos; healthy china &apos; , and other activities will be carried out in the coming days .	此次下乡义诊只是‘健康中国行’的其中一个部分，在以后的日子里，其他活动还将陆续开展。”
0.24670936983675	the last time oil producers are meeting in april , opec member states that have failed to agree on any measures to reach an agreement .	上次产油国召开会议已经是4月份的事情，OPEC成员国未能就任何措施达成协议。
0.24814116028623498	instead , guests can call israel via the kempinski hotel call center .	取而代之的是，客人可以通过凯宾斯基酒店的呼叫中心拨打以色列电话。
0.252193040862776	over the past two season , thompson has stabilized the use of the top 20 in the league , and this is the best of his career last season two .	过去两个赛季，汤普森的使用率已经稳定在了联盟前20，而这也是他生涯最出色的两个赛季。
0.252689606320131	in the first two games in croatia , mr sari received a total of 24 points , 17 rebounds and 12 assists .	克罗地亚在本届奥运会上的前两场比赛，萨里奇一共得到24分、17个篮板和12次助攻。
0.254312299977042	julius nielsen , who has been studying sharks , says that the age of a female head sleeping shark is expected to be between 272 and 512 years of age , up to five meters .	一直研究鲨鱼的 Julius Nielsen 说，据资料记载，有一头雌性小头睡鲨的年龄预计介于272岁至512岁之间，体长达五米。
0.254941268153295	their analysis shows that the biggest shark life is estimated to be 392 years , and the error is 120 years old .	他们的分析显示，这头最大的鲨鱼寿命估计为392岁，误差为120岁。
0.255380782837462	on the 11 th , a number of enterprises have come to qingdao emission trading center to submit emission rights requisition , the requisition will pay the paid user fees .	11日,多家企业分别来到青岛市排污权交易中心提交排污权申购,申购受理后将缴纳有偿使用费。
0.26445642896161803	the relatives of three dead crew members arrived at the maritime court of the sea at 4 am at 4 a.m. on 7 august , and filed an application for the seizure of the suspected carriers .	3名身亡船员的亲属于8月7日凌晨4点赶赴海口海事法院，提起诉前财产保全扣押涉嫌肇事货轮的申请。
0.267600301468308	sounds very complicated ?	听起来很复杂？
0.27766225768930897	in december 2013 , williams has been diagnosed with cancer .	威廉姆斯在2013年12月被确诊为癌症。
0.285382203965317	eight years ago , under ryan &apos;s coaching , they had not tasted success in the international seven-man rugby league in adelaide .	八年前，在瑞恩的执教下，他们在阿德莱得国际七人制橄榄球赛上未尝胜果。
0.298554327925377	after the case , haikou public security bureau police detachment leadership attaches great importance to the immediate organization of a brigade of capable police initiative to launch an investigation .	案件发生后，海口市公安局刑警支队领导高度重视，立即组织支队一大队精干警力主动出击展开侦查。
0.303297337789924	the pleiades cluster is 445 light from the earth .	昂宿星团距离地球445光年。
0.31090609458326196	there is still one last game in brazil , but it is not so much a contest as byers and other gymnasts , but a contest between herself and the pressure of great expectations .	在巴西还有最后一场比赛，但这场比赛与其说是拜尔斯与其他体操选手的竞争，不如说是她自己与巨大期望压力之间的较量。
0.311352196062854	first , the team has accumulated rich experience in continuous research , followed by scientific training , which need to be accumulated over the long term .	首先是教练组在不断研究中积累了丰富经验，其次是科学的训练方式，这些都是需要长期积累的。
0.31165002740311304	the 23-year-old glasgow cyclist replaced his scottish compatriot , sir chris hoy , as the backbone of the team , and even the legendary cyclist was proud of him when the young skinner beat the title-winning new zealand team with a reputation .	这位23岁的格拉斯哥自行车手代替了他的苏格兰同胞——克里斯·霍伊爵士，成为了队伍的中坚。当年轻的斯金纳击败夺冠热门新西兰队并载誉而归时，就连这位传奇自行车手也为他感到骄傲。
0.315242396658496	the trump spokesmen had not responded to this news .	特朗普发言人霍普·希克斯未立即对这一消息予以回应。
0.31597641651034897	this day not only proclaims that it has recovered 100 % of its health , but it is the day that it moves into a luxury birdhouses and meet with human friends who care about it .	这一天不仅宣告着它已100%恢复健康，更是它搬进豪华鸟舍、与关心它的人类朋友们见面的日子。
0.316939904765639	it uses 10,000 metric tons of steel , 20,000 metric tons of concrete and 46 diagonal cables .	它使用了10,000公吨钢材、20,000公吨混凝土和46根斜拉索。
0.31882195305457695	from jumping to jump dismount , dettori has been a typical representative of the british field in the past two decades .	从跳跃冲线到跳跃下马，二十年来，戴图理一直是英国平地赛领域的典型代表。
0.32021571571720603	mr buffett said he was also receiving an irs audit , and trump &quot; feared &quot; was not the tax authorities , but voters .	巴菲特表示，他也正在接受IRS的审计，特朗普“害怕的”不是税务机关，而是选民。
0.32102020834118605	provision includes online learning , case discussion , academic exchanges ; social platforms with hospitals , doctors of the same department ; legal aid , entrepreneurial support and other services needed for doctor-patient relationships or personal life .	提供包括在线学习、病例讨论、学术交流；同医院、同科室医生之间社交平台；医患关系或个人生活所需要的法律援助、创业支持等服务内容。
0.321266678527773	nevertheless , just last month we have got jeremy hunt &apos;s commitment , he said that his door is always open .	尽管如此，就在上个月我们还是得到了杰里米·亨特的承诺，他说自己的大门始终敞开。
0.325797820599938	&quot; it &apos;s not common at the dinner table , &quot; mr coe said .	科先生说道：“这在晚餐的餐桌上并不常见。”
0.3277353320945	japanese oil companies are particularly wary of the rise of china &apos; s small independent refinery , known as the &quot; teapot .	日本油企尤其对被称为“茶壶”的中国小型独立炼油厂崛起表示警惕。
0.33228485661329	but the official narrative that a candidate who was once seen as a presidential candidate has suddenly chosen to take the helm of russia &apos;s environmental policies has drawn much skepticism .	但是，官方说法——一个曾被视为总统候选人的人选突然间选择执掌俄罗斯的环境政策——引来了众多怀疑。
0.33259822905159603	one of the demolition threats is the &quot; jungle book kids &quot; cafe in the camp , which offers 200 food , english and french lessons a day and offers asylum advice to hundreds of unaccompanied vulnerable minors in the camp .	其中一个遭到拆除威胁的地方就是该难民营的“Jungle Book Kids”咖啡馆，该非营利性小店每天提供200份食物、英语及法语课，还为该难民营中数百名无人陪伴的弱势未成年人提供庇护建议。
0.33748970637457604	in response to analysts earlier in the week , comments made by agl operations director stephen michelsen said portland annual energy consumption to about 600 megawatts thomago factory at about 900 megawatts .	针对分析师在本周早些时候发表的评论，AGL运营主管史蒂芬·米克尔森表示波特兰每年的用电量达到约600兆瓦，托马戈工厂达到约900兆瓦。
0.338085532415976	the black coal yard is transformed into a &quot; green grass-like &quot; football field ; the red-brick spires are transformed into a modern sports hall .	黑乎乎的煤场仓库，变成“绿草如茵”的足球场；红砖尖顶的厂房，变成现代化的运动馆。
0.33831355231922805	even 3d printing technology inventor chuck hull is also involved in the design of the beaks .	甚至3D打印技术发明人查克·赫尔也参与到格雷西亚上喙的设计中来。
0.34291445817187505	low also said in a monthly report that the low price of crude oil has prompted global refiners to produce more refined oil , thereby exacerbating the market oversupply .	OPEC还在月报中表示，原油价格低廉已促使全球炼油商生产更多精炼油品，从而加重了市场供应过剩的程度。
0.343611553448826	march 29 , 2014 , cctv news survey produced &quot; corridor doctor &quot; program broadcast .	2014年3月29日，央视新闻调查制作的《走廊医生》节目播出。
0.34713484135547695	sunscreen packaging are generally marked with spf and pa , spf refers to the spf , is for uvb uv , our common spf index has 15,30,50 and so on .	防晒霜包装上一般都标有SPF和PA，SPF是指防晒指数，是针对UVB紫外线的，我们常见的SPF指数有15、30、50等。
0.353118313572815	students clash with police during a protest against the reform of the government &apos;s public education system in sao paulo , brazil , on thursday .	周四，在巴西圣保罗，学生在抗议政府公共教育体系改革的过程中与警方发生了冲突。
0.354301569728729	&quot; it &apos;s time to become a multi-brand bank , because in private we have been exploring how to become a better service to our customers , &quot; the chief executive said .	首席执行官表示：“现在到了成为一家多品牌银行的时候，因为私下我们一直在探求如何成为一家更好的服务于客户的银行。”
0.35508612607068607	if the two factories closed , the power market demand will be greatly reduced .	如果两家工厂关闭，则电力市场的需求量会大大减少。
0.35566600254795	there are other , more prominent , smaller private banking brands , such as gu capital bank , adam &amp; co , drummond and holt &apos;s military bank .	还有一些其它更突出的较小私人银行品牌，例如顾资银行、Adam & Co、 Drummond 与 Holt's Military Bank。
0.356778403340656	in order to save money , the governor of sao paulo , the state governor , plans to close 100 public schools and 300,000 students will be transferred .	为了节省资金，圣保罗州州长奥克明计划关闭100所公立学校，30万名学生将转校。
0.358942723148067	proceeding from our national conditions , china does not encourage the export of steel , but also adopted a series of practical measures to control the export of steel .	从我国国情出发，我国并不鼓励钢材出口，相反，还采取一系列切实措施控制钢材出口。
0.3605456451606429	investigators told cbs philadelphia that it looked like a gunman crossfire .	调查人员告诉 CBS Philadelphia，看起来像是多名枪手交火。
0.361499670903049	if not wife eleanor encouraged him to set an example on his diet , president roosevelt might have made the same mistake .	如果不是妻子埃莉诺鼓励他在饮食上树立榜样，罗斯福总统可能也会犯相同的错误。
0.363902187177303	to meet the needs of tourism development , july 2014 set up a tour police team to patrol the main attractions , help and guide visitors .	为适应旅游发展需要，2014年7月成立旅游警察队伍，负责在各大景点巡逻保卫，帮助和疏导游客。
0.3700218580621599	tajikistan &apos;s &quot; avista &quot; news agency quoted the central bank as saying the inflation rate was 3.7 % in the first seven months of this year .	塔吉克斯坦“阿维斯塔”通讯社11日援引塔央行的消息称，今年前7个月塔国的通货膨胀率为3.7%。
0.37444012733345	in thursday &apos;s lawsuit , u.s. district judge beth lamson freeman said geely did not have to bear the cost of the defence .	在周四的诉讼中，美国地区法官贝斯·兰博松·弗里曼表示，吉利德无需承担因辩护所产生的费用。
0.376241966151186	when they pass through the magnetic field of the star , they have a brake effect on the stars .	当这些恒星风穿过恒星的磁场时，它们会对恒星产生制动作用。
0.376850211618258	the new service is quick , saves administrative costs ; second is respect , protection of citizens &apos; privacy , and the third day , all-weather and all-time service .	这个新服务功能一是快捷，节省行政成本；二是尊重、保护公民个人隐私；三是全天候、全时段服务。
0.3789482312583499	the criticism of isis intelligence is reminiscent of the controversy more than a decade ago , when central command intelligence analyst gregory hooker wrote a research article noting that george w. bush &apos;s administration , despite opposition from many analysts , insisted on sending small troops to iraq and barely considering the post-2003 invasion .	有关伊斯兰国情报的批评令人想起出十多年前的争议，当时中央司令部情报分析员格雷戈里·胡克撰写了一篇研究文章，文中指出乔治·布什的政府不顾众多分析员的反对，坚持派遣小规模的部队前往伊拉克并且几乎没有考虑2003年入侵后的情况。
0.381198781463589	why we need simon , gabrielle and larry	为何我们需要西蒙、加布丽埃勒和劳瑞
0.38244604840497204	queensferry bridge construction company project director michael martin said : &quot; no matter which bridge project , the first closure is a significant milestone . &quot;	"昆斯费里大桥建造公司项目总监 Michael Martin 说：""不管是哪个大桥项目，第一次合龙都是一个重大里程碑。"""
0.38727837115562297	according to forecasts by the tata trade and economic development department , the country &apos;s economic growth will reach 7 percent in 2016 , while the country &apos;s inflation is basically above this level .	根据塔贸易和经济发展部的预测，2016年塔国的经济增长将达到7%，而国家的通胀也基本是在这一水平之上。
0.3956678935887729	but i think his enthusiasm implies something opposite .	但是，我认为他的热情暗示了某些相反的东西。
0.396511118840816	at present , the new collective economy in southern jiangsu mainly forms the four development modes of asset leasing , enterprise stock , agricultural development and joint development .	目前，苏南农村新集体经济主要形成了资产租赁型、企业股份型、农业开发型、联合发展型4种发展模式。
0.398531748274414	okafor &apos;s situation is more embarrassing , as the first choice of 76 people last season , he had to compete with simmons and enbid in the new season to play time and ball rights .	奥卡福的情况比较尴尬，作为上赛季76人的第一选择，他在新赛季不得不和西蒙斯以及恩比德竞争上场时间和球权。
0.401090212754421	on thursday , in the medium as a product manager and engineer zhu had decided to remove her snapchat account and encouraged others to do the same .	周四，在Medium担任产品经理和工程师的朱女士决定删除她的Snapchat帐号并且鼓励他人也这么做。
0.402308798552137	from mid-2014 to mid-2015 , most high-level intelligence officials from the united states central command manipulated the command &apos;s intelligence products , concealing the threat posed by the islamic state of iraq .	自2014年中期到2015年中期，美国中央司令部的大部分高层情报官员操控了司令部的情报产品，隐瞒了伊拉克伊斯兰国的威胁。
0.405822728057311	the lack of professionalism in internet companies and data companies is not uniform in the way they write on the same entry .	互联网公司、数据公司缺少专业性，在同一词条上的书写方法上都达不到统一。
0.41029860674412494	the &quot; teapot refinery &quot; has been able to import crude oil from oman , which has a low sulphur content , and russian crude oil , and the quality of its oil products has also improved , after obtaining import permits .	在获得原油进口许可后，“茶壶炼油厂”能够进口硫磺含量较低的阿曼产原油和俄罗斯产原油，其石油产品的品质也出现提升。
0.426535202216219	police had searched the house in 2014 and found 70dock cannabis and also found scales , drug paraphernalia and £ 1,700 in cash .	2014年，警方曾搜查了该房屋，发现了70多克大麻，还发现了天平、吸毒用具及1,700英镑现金。
0.42665764037769305	the company &apos;s portland smelter is now losing money and facing the risk of closing it .	美铝公司波特兰冶炼厂目前正在亏损并且面临关闭风险。
0.4284039642669821	the whole canadian audience was shocked by the tone and wording of the commentator , after which they quickly reacted on the network .	整个加拿大的观众都被这位解说员的语气及措辞给惊到了，之后他们很快在网络上做出了反应
0.437246969962869	the lack of funding for community legal services has already exceeded the limits and is now faced with further funding cuts .	社区法律服务的资金缺乏早已超过了限值，现在又要面临进一步的资金削减。
0.44711262914222705	the current research focuses on profound changes in areas such as global political , economic , scientific and cultural , and the opportunities and challenges posed by these changes to national governance , leadership and global governance .	目前研究内容主要集中在全球政治、经济、科技、文化宗教等领域的深刻变化,以及这些变化对国家治理、领导力、全球治理带来的机遇和挑战。
0.447749101079594	in general , the way to explore mars is similar to that of detecting the moon , and it is &quot; around , down , to travel , back to , &quot; and finally to achieve the goal of a manned landing on mars .	庞之浩说，总体来讲，探测火星的方式与探测月球的方式相似，也是“绕、落、巡、回”，最终实现载人登陆火星的目标。
0.45806968477354204	he was obviously detached from the people .	他显然脱离了人民。
